"ID";"CNAE";"DESCRIPCION"
363;"5114";"INTERMED. COMERC. MAQUIN.; EQUIPO IND. EMBARCAC. Y AERONAVES"
364;"5115";"INTERMED. COMERCIO MUEBLES; ARTICULOS HOGAR Y FERRETERIA"
365;"5116";"INTERMED. COMERCIO TEX.; PRENDAS VESTIR; CALZ. Y ART. CUERO"
366;"5117";"INTERMED. COMERCIO PRODUCTOS ALIMENTICIOS; BEBIDAS Y TABACO"
367;"5118";INTERMED. COMERCIO ESP. VENTA PROD. ESPECIF. NO MENCIONADOS
368;"5119";INTERMEDIARIOS DEL COMERCIO DE PRODUCTOS DIVERSOS
369;"5120";COMERC.POR MAYOR DE MATERIAS PRIMAS AGRAR. Y ANIMALES VIVOS
370;"5121";"COMERC. MAYOR DE CEREALES; SIMIENTES Y ALIMENTOS PARA GANADO"
371;"5122";COMERCIO AL POR MAYOR DE FLORES Y PLANTAS
372;"5123";COMERCIO AL POR MAYOR DE ANIMALES VIVOS
373;"5124";COMERCIO AL POR MAYOR DE CUEROS Y PIELES
374;"5125";COMERCIO AL POR MAYOR DE TABACO EN RAMA
375;"5130";"COMERC.POR MAYOR DE PRODUCTOS ALIMENTICIOS; BEBIDAS Y TABACO"
376;"5131";"COMERCIO AL POR MAYOR DE FRUTAS; PATATAS Y VERDURAS"
377;"5132";COMERCIO AL POR MAYOR DE CARNE Y PRODUCTOS CARNICOS
378;"5133";"COMERC. MAYOR PROD. LACTEOS; HUEVOS; ACEITES Y GRASAS COMEST"
379;"5134";COMERCIO AL POR MAYOR DE BEBIDAS
380;"5135";COMERCIO AL POR MAYOR DE PRODUCTOS DEL TABACO
381;"5136";"COMERCIO AL POR MAYOR DE AZUCAR; CHOCOLATE Y CONFITERIA"
382;"5137";"COMERCIO AL POR MAYOR DE CAFE; TE; CACAO Y ESPECIAS"
383;"5138";COMERC. MAYOR PESCADOS Y MARISCOS Y OTROS PDTOS. ALIMENTIC.
384;"5139";"COMERC. MAYOR NO ESPECIALIZ.; PDTOS. ALIMENT. BEB. Y TABACO"
385;"5140";COMERC.POR MAYOR DE PRODUCTOS DE CONSUMO NO ALIMENTICIOS
386;"5141";COMERCIO AL POR MAYOR DE TEXTILES
387;"5142";COMERCIO AL POR MAYOR DE PRENDAS DE VESTIR Y CALZADO
388;"5143";COMERC. MAYOR APARATOS ELECTRODOM. Y APARAT. RADIO Y TELEV.
389;"5144";"COMERC. MAYOR PORCEL. Y CRISTAL.; PAPELES PINT. Y ART. LIMP."
390;"5145";COMERCIO AL POR MAYOR DE PERFUMERIA Y PRODUCTOS DE BELLEZA
391;"5146";COMERCIO AL POR MAYOR DE PRODUCTOS FARMACEUTICOS
392;"5147";COMERC. MAYOR OTROS BIENES CONSUMO DISTINTO ALIMENTACION
393;"5150";"COMERC.POR MAYOR DE PROD.NO AGRARIOS SEMIELABORADOS;CHATARRA"
394;"5151";"COMERC. MAYOR DE COMBUSTIB. SOLIDOS; LIQUIDOS Y GASEOSOS"
395;"5152";COMERCIO AL POR MAYOR DE METALES Y MINERALES METALICOS
396;"5153";"COMERC. MAYOR MADERA; MAT. CONSTRUCCION Y APARAT. SANITARIOS"
397;"5154";"COMERCIO AL POR MAYOR DE FERRETERIA;FONTANERIA Y CALEFACCION"
398;"5155";COMERCIO AL POR MAYOR DE PRODUCTOS QUIMICOS
399;"5156";COMERCIO AL POR MAYOR DE OTROS PRODUCTOS SEMIELABORADOS
400;"5157";COMERCIO AL POR MAYOR DE CHATARRA Y PRODUCTOS DE DESECHO
401;"5160";COMERCIO AL POR MAYOR DE MAQUINARIA Y EQUIPO
402;"5161";COMERCIO AL POR MAYOR DE MAQUINAS-HERRAMIENTAS
403;"5162";COMERCIO AL POR MAYOR DE MAQUINARIA PARA LA CONSTRUCCION
404;"5163";COMERC. MAYOR MAQUINARIA INDUSTRIA TEXTIL MAQ. COSER Y PUNTO
405;"5164";COMERCIO AL POR MAYOR DE MAQUINAS Y EQUIPO DE OFICINA
406;"5165";COMERC. MAYOR OTRA MAQUINARIA PARA LA INDUST. COM. Y NAVEG.
407;"5166";"COMERC. MAYOR MAQUINAS; ACCESORIOS Y UTILES AGRICOLAS"
408;"5170";OTRO COMERCIO AL POR MAYOR
409;"5210";COMERCIO AL POR MENOR EN ESTABLECIMIENTOS NO ESPECIALIZADOS
410;"5211";"COMERC. MENOR; ALIMENTOS;BEBIDAS Y TABACO EN ESTAB.NO ESPEC."
411;"5212";COMERC. MENOR OTROS PDTOS. ESTABLEC. NO ESPECIALIZADOS
412;"5220";"COMERC .POR MENOR DE ALIMENTOS;BEBIDAS Y TABACO EN ESTABL."
413;"5221";COMERCIO AL POR MENOR DE FRUTAS Y VERDURAS
414;"5222";COMERCIO AL POR MENOR DE CARNE Y PRODUCTOS CARNICOS
415;"5223";COMERCIO AL POR MENOR DE PESCADOS Y MARISCOS
416;"5224";"COMERC. MENOR PAN Y PROD. PANADERIA; CONFITERIA Y PASTELERIA"
417;"5225";COMERCIO AL POR MENOR DE BEBIDAS
418;"5226";COMERCIO AL POR MENOR DE PRODUCTOS DE TABACO
419;"5227";COMERC. MENOR EN ESTABL. ESPECIALIZ. EN ALIMENTACION
420;"5230";"COMERC.POR MENOR DE PROD.FARMACEUTICOS;ARTIC. BELLEZA; HIGIENE"
421;"5231";COMERCIO AL POR MENOR DE PRODUCTOS FARMACEUTICOS
422;"5232";COMERCIO AL POR MENOR DE ARTICULOS MEDICOS Y ORTOPEDICOS
423;"5233";COMERCIO AL POR MENOR DE COSMETICOS Y ARTICULOS DE TOCADOR
424;"5240";OTRO COMERC.POR MENOR DE ARTIC. NUEVOS EN ESTABL.ESPECIALIZ.
425;"5241";COMERCIO AL POR MENOR DE TEXTILES
426;"5242";COMERCIO AL POR MENOR DE PRENDAS DE VESTIR
427;"5243";COMERCIO AL POR MENOR DE CALZADO Y ARTICULOS DE CUERO
428;"5244";COMERC. MENOR MUEBLES; APARATOS ILUMINAC. Y OTROS ART. HOGAR
429;"5245";"COMERC. MENOR ELECTRODOMEST.; APARATOS RADIO; TV. Y SONIDO"
430;"5246";"COMERCIO AL POR MENOR DE FERRETERIA; PINTURAS Y VIDRIO"
431;"5247";"COMERCIO AL POR MENOR DE LIBROS; PERIODICOS Y PAPELERIA"
432;"5248";OTRO COMERCIO MENOR EN ESTABLECIMIENTOS ESPECIALIZADOS
433;"5250";COMERC.POR MENOR DE BIENES DE SEGUNDA MANO EN ESTABLECIMIEN.
434;"5260";COMERCIO AL POR MENOR NO REALIZADO EN ESTABLECIMIENTOS
435;"5261";COMERCIO AL POR MENOR POR CORRESPONDENCIA
436;"5262";COMERCIO AL POR MENOR EN PUESTOS DE VENTA Y MERCADILLOS
437;"5263";OTRO COMERCIO AL POR MENOR NO REALIZADO EN ESTABLECIMIENTOS
438;"5270";REPARACION DE EFECTOS PERSONALES Y ENSERES DOMESTICOS
439;"5271";REPARACION DE CALZADO Y OTROS ARTICULOS DE CUERO
440;"5272";REPARACION DE APARATOS DOMESTICOS ELECTRICOS
441;"5273";REPARACION DE RELOJES Y JOYERIA
442;"5274";OTRA REPARACION
443;"5510";HOTELES
444;"5511";"HOTELES; MOTELES; HOSTALES Y PENSIONES CON RESTAURANTE"
445;"5512";"HOTELES; MOTELES; HOSTALES Y PENSIONES SIN RESTAURANTE"
446;"5520";CAMPING Y OTROS TIPOS DE HOSPEDAJE DE CORTA DURACION
447;"5521";ALBERGUES JUVENILES Y REFUGIOS DE MONTAÑA
448;"5522";CAMPING
449;"5523";OTROS TIPOS DE HOSPEDAJE
450;"5530";RESTAURANTES
451;"5540";ESTABLECIMIENTOS DE BEBIDAS
452;"5550";COMEDORES COLECTIVOS Y PROVISION DE COMIDAS PREPARADAS
453;"5551";COMEDORES COLECTIVOS
454;"5552";PROVISION DE COMIDAS PREPARADAS
455;"6010";TRANSPORTE POR FERROCARRIL
456;"6020";OTROS TIPOS DE TRANSPORTE TERRESTRE
457;"6021";OTROS TIPOS DE TRANSPORTE TERRESTRE REGULAR DE VIAJEROS
458;"6022";TRANSPORTE POR TAXI
459;"6023";OTROS TIPOS DE TRANSPORTE TERRESTRE DISCRECIONAL DE VIAJEROS
460;"6024";TRANSPORTE DE MERCANCIAS POR CARRETERA
461;"6030";TRANSPORTE POR TUBERIA
347;"4540";ACABADO DE EDIFICIOS Y OBRAS
349;"4542";INSTALACIONES DE CARPINTERIA
350;"4543";REVESTIMIENTO DE SUELOS Y PAREDES
351;"4544";ACRISTALAMIENTO Y PINTURA
352;"4545";OTROS TRABAJOS DE ACABADO DE EDIFICIOS Y OBRAS
353;"4550";ALQUILER DE EQUIPO DE CONSTRUCCION O DEMOLICION DOTADO DE OP
354;"5010";VENTA DE VEHICULOS DE MOTOR                               
355;"5020";MANTENIMIENTO Y REPARACION DE VEHICULOS DE MOTOR          
356;"5030";VENTA DE REPUESTOS Y ACCESORIOS DE VEHICULOS DE MOTOR     
357;"5040";"VENTA; MANTENIM. REPARACION DE MOTOCICLETAS Y CICLOMOTORES"
358;"5050";VENTA AL POR MENOR DE CARBURANTES PARA LA AUTOMOCION      
359;"5110";INTERMEDIARIOS DEL COMERCIO
360;"5111";"INTERM. COM. MAT. PRIMAS AGRAR.; ANIMALES; MAT. PRIMAS TEX."
361;"5112";"INTERMED. COMERC. COMBUST.; MINERALES; MET. Y PDTOS. QUIMIC."
462;"6110";TRANSPORTE MARITIMO                              
463;"6120";TRANSPORTE POR VIAS DE NAVEGACION INTERIORES     
464;"6210";TRANSPORTE AEREO REGULAR     
465;"6220";TRANSPORTE AEREO DISCRECIONAL
466;"6230";TRANSPORTE ESPACIAL          
467;"6310";MANIPULACION Y DEPOSITO DE MERCANCIAS
468;"6311";MANIPULACION DE MERCANCIAS
469;"6312";DEPOSITO Y ALMACENAMIENTO
470;"6320";OTRAS ACTIVIDADES ANEXAS A LOS TRANSPORTES
471;"6321";OTRAS ACTIVIDADES ANEXAS AL TRANSPORTE TERRESTRE
472;"6322";OTRAS ACTIVIDADES ANEXAS AL TRANSPORTE MARITIMO
473;"6323";OTRAS ACTIVIDADES ANEXAS AL TRANSPORTE AEREO
474;"6330";"ACTIVID.DE AGENCIAS DE VIAJES; MAYOR. Y MINORIST. DE TURISMO"
475;"6340";ORGANIZACION DEL TRANSPORTE DE MERCANCIAS
476;"6410";ACTIVIDADES POSTALES Y DE CORREO
477;"6411";ACTIVIDADES POSTALES NACIONALES
478;"6412";ACTIV. CORREO DISTINTAS DE LAS ACTIV. POSTALES NACIONALES
479;"6420";TELECOMUNICACIONES
480;"6510";INTERMEDIACION MONETARIA
481;"6511";BANCA CENTRAL
482;"6512";OTROS TIPOS DE INTERMEDIACION MONETARIA
483;"6520";OTROS TIPOS DE INTERMEDIACION FINANCIERA
484;"6521";ARRENDAMIENTO FINANCIERO
485;"6522";OTROS TIPOS DE ACTIVIDADES CREDITICIAS
486;"6523";OTROS DIVERSOS TIPOS DE INTERMEDIACION FINANCIERA
487;"6600";"SEGUROS Y PLANES DE PENSIONES; EXCEPTO SEGUR. SOCIAL OBLIGAT."
488;"6601";SEGUROS DE VIDA
489;"6602";PLANES DE PENSIONES
490;"6603";SEGUROS NO VIDA
1007;"0114";CULTIVO DE CAÑA DE AZUCAR
1008;"0115";CULTIVO DE TABACO
1009;"0116";CULTIVO DE PLANTAS PARA FIBRAS TEXTILES
1010;"0119";OTROS CULTIVOS NO PERENNES
1012;"0121";CULTIVO DE LA VID
1013;"0122";CULTIVO DE FRUTOS TROPICALES Y SUBTROPICALES
1014;"0123";CULTIVO DE CITRICOS
1015;"0124";CULTIVO DE FRUTOS CON HUESO Y PEPITAS
1016;"0125";CULTIVO DE OTROS ARBOLES Y ARBUSTOS FRUTALES Y FRUTOS SECOS
1017;"0126";CULTIVO DE FRUTOS OLEAGINOSOS
1018;"0127";CULTIVO DE PLANTAS PARA BEBIDAS
1019;"0128";"CULTIVO DE ESPECIAS; PLANTAS AROMATICAS; MEDICINALES Y FARMACEUTICAS"
1020;"0129";OTROS CULTIVOS PERENNES
1022;"0130";PROPAGACION DE PLANTAS
1024;"0141";EXPLOTACION DE GANADO BOVINO PARA LA PRODUCCION DE LECHE
1025;"0142";EXPLOTACION DE OTRO GANADO BOVINO Y BUFALOS
1026;"0143";EXPLOTACION DE CABALLOS Y OTROS EQUINOS
1027;"0144";EXPLOTACION DE CAMELLOS Y OTROS CAMELIDOS
1028;"0145";EXPLOTACION DE GANADO OVINO Y CAPRINO
1029;"0146";EXPLOTACION DE GANADO PORCINO
1030;"0147";AVICULTURA
1031;"0149";OTRAS EXPLOTACIONES DE GANADO
1033;"0150";PRODUCCION AGRICOLA COMBINADA CON LA PRODUCCION GANADERA
1035;"0161";ACTIVIDADES DE APOYO A LA AGRICULTURA
1036;"0162";ACTIVIDADES DE APOYO A LA GANADERIA
1037;"0163";ACTIVIDADES DE PREPARACION POSTERIOR A LA COSECHA
1038;"0164";TRATAMIENTO DE SEMILLAS PARA REPRODUCCION
1040;"0170";"CAZA; CAPTURA DE ANIMALES Y SERVICIOS RELACIONADOS CON LAS MISMAS"
1043;"0210";SILVICULTURA Y OTRAS ACTIVIDADES FORESTALES
1045;"0220";EXPLOTACION DE LA MADERA
1047;"0230";"RECOLECCION DE PRODUCTOS SILVESTRES; EXCEPTO MADERA"
1049;"0240";SERVICIOS DE APOYO A LA SILVICULTURA
1052;"0311";PESCA MARINA
1053;"0312";PESCA EN AGUA DULCE
1055;"0321";ACUICULTURA MARINA
1056;"0322";ACUICULTURA EN AGUA DULCE
1060;"0510";EXTRACCION DE ANTRACITA Y HULLA
1062;"0520";EXTRACCION DE LIGNITO
1065;"0610";EXTRACCION DE CRUDO DE PETROLEO
1067;"0620";EXTRACCION DE GAS NATURAL
1070;"0710";EXTRACCION DE MINERALES DE HIERRO
1072;"0721";EXTRACCION DE MINERALES DE URANIO Y TORIO
1073;"0729";EXTRACCION DE OTROS MINERALES METALICOS NO FERREOS
1076;"0811";"EXTRACCION DE PIEDRA ORNAMENTAL Y PARA LA CONSTRUCCION; PIEDRA CALIZA; YESO; CRETA Y PIZARRA"
1077;"0812";EXTRACCION DE GRAVAS Y ARENAS; EXTRACCION DE ARCILLA Y CAOLIN
1079;"0891";EXTRACCION DE MINERALES PARA PRODUCTOS QUIMICOS Y FERTILIZANTES
1080;"0892";EXTRACCION DE TURBA
1081;"0893";EXTRACCION DE SAL
1082;"0899";OTRAS INDUSTRIAS EXTRACTIVAS N.C.O.P.
1085;"0910";ACTIVIDADES DE APOYO A LA EXTRACCION DE PETROLEO Y GAS NATURAL
1087;"0990";ACTIVIDADES DE APOYO A OTRAS INDUSTRIAS EXTRACTIVAS
1091;"1011";PROCESADO Y CONSERVACION DE CARNE
1092;"1012";PROCESADO Y CONSERVACION DE VOLATERIA
1093;"1013";ELABORACION DE PRODUCTOS CARNICOS Y DE VOLATERIA
1095;"1021";"PROCESADO DE PESCADOS; CRUSTACEOS Y MOLUSCOS"
1096;"1022";FABRICACION DE CONSERVAS DE PESCADO
1098;"1031";PROCESADO Y CONSERVACION DE PATATAS
1099;"1032";ELABORACION DE ZUMOS DE FRUTAS Y HORTALIZAS
1100;"1039";OTRO PROCESADO Y CONSERVACION DE FRUTAS Y HORTALIZAS
1102;"1042";FABRICACION DE MARGARINA Y GRASAS COMESTIBLES SIMILARES
1103;"1043";FABRICACION DE ACEITE DE OLIVA
1104;"1044";FABRICACION DE OTROS ACEITES Y GRASAS
1106;"1052";ELABORACION DE HELADOS
1107;"1053";FABRICACION DE QUESOS
1108;"1054";PREPARACION DE LECHE Y OTROS PRODUCTOS LACTEOS
1110;"1061";FABRICACION DE PRODUCTOS DE MOLINERIA
1111;"1062";FABRICACION DE ALMIDONES Y PRODUCTOS AMILACEOS
1113;"1071";FABRICACION DE PAN Y DE PRODUCTOS FRESCOS DE PANADERIA Y PASTELERIA
1114;"1072";FABRICACION DE GALLETAS Y PRODUCTOS DE PANADERIA Y PASTELERIA DE LARGA DURACION
1115;"1073";"FABRICACION DE PASTAS ALIMENTICIAS; CUSCUS Y PRODUCTOS SIMILARES"
1117;"1081";FABRICACION DE AZUCAR
1118;"1082";"FABRICACION DE CACAO; CHOCOLATE Y PRODUCTOS DE CONFITERIA"
1119;"1083";"ELABORACION DE CAFE; TE E INFUSIONES"
1120;"1084";"ELABORACION DE ESPECIAS; SALSAS Y CONDIMENTOS"
1121;"1085";ELABORACION DE PLATOS Y COMIDAS PREPARADOS
1122;"1086";ELABORACION DE PREPARADOS ALIMENTICIOS HOMOGENEIZADOS Y ALIMENTOS DIETETICOS
1123;"1089";ELABORACION DE OTROS PRODUCTOS ALIMENTICIOS N.C.O.P.
1125;"1091";FABRICACION DE PRODUCTOS PARA LA ALIMENTACION DE ANIMALES DE GRANJA
1126;"1092";FABRICACION DE PRODUCTOS PARA LA ALIMENTACION DE ANIMALES DE COMPAÑIA
1129;"1101";"DESTILACION; RECTIFICACION Y MEZCLA DE BEBIDAS ALCOHOLICAS"
1130;"1102";ELABORACION DE VINOS
1131;"1103";ELABORACION DE SIDRA Y OTRAS BEBIDAS FERMENTADAS A PARTIR DE FRUTAS
1132;"1104";"ELABORACION DE OTRAS BEBIDAS NO DESTILADAS; PROCEDENTES DE LA FERMENTACION"
1133;"1105";FABRICACION DE CERVEZA
1134;"1106";FABRICACION DE MALTA
1135;"1107";FABRICACION DE BEBIDAS NO ALCOHOLICAS; PRODUCCION DE AGUAS MINERALES Y OTRAS AGUAS EMBOTELLADAS
1138;"1200";INDUSTRIA DEL TABACO
1141;"1310";PREPARACION E HILADO DE FIBRAS TEXTILES
1143;"1320";FABRICACION DE TEJIDOS TEXTILES
1145;"1330";ACABADO DE TEXTILES
1147;"1391";FABRICACION DE TEJIDOS DE PUNTO
1148;"1392";"FABRICACION DE ARTICULOS CONFECCIONADOS CON TEXTILES; EXCEPTO PRENDAS DE VESTIR"
1149;"1393";FABRICACION DE ALFOMBRAS Y MOQUETAS
1150;"1394";"FABRICACION DE CUERDAS; CORDELES; BRAMANTES Y REDES"
1151;"1395";"FABRICACION DE TELAS NO TEJIDAS Y ARTICULOS CONFECCIONADOS CON ELLAS; EXCEPTO PRENDAS DE VESTIR"
1152;"1396";FABRICACION DE OTROS PRODUCTOS TEXTILES DE USO TECNICO E INDUSTRIAL
1153;"1399";FABRICACION DE OTROS PRODUCTOS TEXTILES N.C.O.P.
1156;"1411";CONFECCION DE PRENDAS DE VESTIR DE CUERO
1157;"1412";CONFECCION DE ROPA DE TRABAJO
1158;"1413";CONFECCION DE OTRAS PRENDAS DE VESTIR EXTERIORES
1159;"1414";CONFECCION DE ROPA INTERIOR
1160;"1419";CONFECCION DE OTRAS PRENDAS DE VESTIR Y ACCESORIOS
1162;"1420";FABRICACION DE ARTICULOS DE PELETERIA
1164;"1431";CONFECCION DE CALCETERIA
1165;"1439";CONFECCION DE OTRAS PRENDAS DE VESTIR DE PUNTO
1168;"1511";"PREPARACION; CURTIDO Y ACABADO DEL CUERO; PREPARACION Y TEÑIDO DE PIELES"
1169;"1512";"FABRICACION DE ARTICULOS DE MARROQUINERIA; VIAJE Y DE GUARNICIONERIA Y TALABARTERIA"
1171;"1520";FABRICACION DE CALZADO
1174;"1610";ASERRADO Y CEPILLADO DE LA MADERA
1176;"1621";FABRICACION DE CHAPAS Y TABLEROS DE MADERA
1177;"1622";FABRICACION DE SUELOS DE MADERA ENSAMBLADOS
1178;"1623";FABRICACION DE OTRAS ESTRUCTURAS DE MADERA Y PIEZAS DE CARPINTERIA Y EBANISTERIA PARA LA CONSTRUCCION
1179;"1624";FABRICACION DE ENVASES Y EMBALAJES DE MADERA
1180;"1629";"FABRICACION DE OTROS PRODUCTOS DE MADERA; ARTICULOS DE CORCHO; CESTERIA Y ESPARTERIA"
1183;"1711";FABRICACION DE PASTA PAPELERA
1184;"1712";FABRICACION DE PAPEL Y CARTON
1186;"1721";FABRICACION DE PAPEL Y CARTON ONDULADOS; FABRICACION DE ENVASES Y EMBALAJES DE PAPEL Y CARTON
1187;"1722";"FABRICACION DE ARTICULOS DE PAPEL Y CARTON PARA USO DOMESTICO; SANITARIO E HIGIENICO"
1625;"4782";"COMERCIO AL POR MENOR DE PRODUCTOS TEXTILES; PRENDAS DE VESTIR Y CALZADO EN PUESTOS DE VENTA Y EN MERCADILLOS"
1626;"4789";COMERCIO AL POR MENOR DE OTROS PRODUCTOS EN PUESTOS DE VENTA Y EN MERCADILLOS
1628;"4791";COMERCIO AL POR MENOR POR CORRESPONDENCIA O INTERNET
1629;"4799";"OTRO COMERCIO AL POR MENOR NO REALIZADO NI EN ESTABLECIMIENTOS; NI EN PUESTOS DE VENTA NI EN MERCADILLOS"
1633;"4910";TRANSPORTE INTERURBANO DE PASAJEROS POR FERROCARRIL
1635;"4920";TRANSPORTE DE MERCANCIAS POR FERROCARRIL
1637;"4931";TRANSPORTE TERRESTRE URBANO Y SUBURBANO DE PASAJEROS
1638;"4932";TRANSPORTE POR TAXI
1639;"4939";TIPOS DE TRANSPORTE TERRESTRE DE PASAJEROS N.C.O.P.
1641;"4941";TRANSPORTE DE MERCANCIAS POR CARRETERA
1642;"4942";SERVICIOS DE MUDANZA
1644;"4950";TRANSPORTE POR TUBERIA
1647;"5010";TRANSPORTE MARITIMO DE PASAJEROS
1649;"5020";TRANSPORTE MARITIMO DE MERCANCIAS
1651;"5030";TRANSPORTE DE PASAJEROS POR VIAS NAVEGABLES INTERIORES
1653;"5040";TRANSPORTE DE MERCANCIAS POR VIAS NAVEGABLES INTERIORES
1656;"5110";TRANSPORTE AEREO DE PASAJEROS
1658;"5121";TRANSPORTE AEREO DE MERCANCIAS
1659;"5122";TRANSPORTE ESPACIAL
1662;"5210";DEPOSITO Y ALMACENAMIENTO
1664;"5221";ACTIVIDADES ANEXAS AL TRANSPORTE TERRESTRE
1665;"5222";ACTIVIDADES ANEXAS AL TRANSPORTE MARITIMO Y POR VIAS NAVEGABLES INTERIORES
1666;"5223";ACTIVIDADES ANEXAS AL TRANSPORTE AEREO
1667;"5224";MANIPULACION DE MERCANCIAS
1668;"5229";OTRAS ACTIVIDADES ANEXAS AL TRANSPORTE
1671;"5310";ACTIVIDADES POSTALES SOMETIDAS A LA OBLIGACION DEL SERVICIO UNIVERSAL
1673;"5320";OTRAS ACTIVIDADES POSTALES Y DE CORREOS
1677;"5510";HOTELES Y ALOJAMIENTOS SIMILARES
1679;"5520";ALOJAMIENTOS TURISTICOS Y OTROS ALOJAMIENTOS DE CORTA ESTANCIA
1681;"5530";CAMPINGS Y APARCAMIENTOS PARA CARAVANAS
1683;"5590";OTROS ALOJAMIENTOS
1686;"5610";RESTAURANTES Y PUESTOS DE COMIDAS
1688;"5621";PROVISION DE COMIDAS PREPARADAS PARA EVENTOS
1689;"5629";OTROS SERVICIOS DE COMIDAS
1691;"5630";ESTABLECIMIENTOS DE BEBIDAS
1695;"5811";EDICION DE LIBROS
1696;"5812";EDICION DE DIRECTORIOS Y GUIAS DE DIRECCIONES POSTALES
1697;"5813";EDICION DE PERIODICOS
1698;"5814";EDICION DE REVISTAS
1699;"5819";OTRAS ACTIVIDADES EDITORIALES
1701;"5821";EDICION DE VIDEOJUEGOS
1702;"5829";EDICION DE OTROS PROGRAMAS INFORMATICOS
1705;"5912";"ACTIVIDADES DE POSTPRODUCCION CINEMATOGRAFICA; DE VIDEO Y DE PROGRAMAS DE TELEVISION"
1706;"5914";ACTIVIDADES DE EXHIBICION CINEMATOGRAFICA
1707;"5915";ACTIVIDADES DE PRODUCCION CINEMATOGRAFICA Y DE VIDEO
1708;"5916";ACTIVIDADES DE PRODUCCIONES DE PROGRAMAS DE TELEVISION
1709;"5917";ACTIVIDADES DE DISTRIBUCION CINEMATOGRAFICA Y DE VIDEO
1710;"5918";ACTIVIDADES DE DISTRIBUCION DE PROGRAMAS DE TELEVISION
1712;"5920";ACTIVIDADES DE GRABACION DE SONIDO Y EDICION MUSICAL
1715;"6010";ACTIVIDADES DE RADIODIFUSION
1717;"6020";ACTIVIDADES DE PROGRAMACION Y EMISION DE TELEVISION
1720;"6110";TELECOMUNICACIONES POR CABLE
1722;"6120";TELECOMUNICACIONES INALAMBRICAS
1724;"6130";TELECOMUNICACIONES POR SATELITE
1726;"6190";OTRAS ACTIVIDADES DE TELECOMUNICACIONES
1729;"6201";ACTIVIDADES DE PROGRAMACION INFORMATICA
1730;"6202";ACTIVIDADES DE CONSULTORIA INFORMATICA
1731;"6203";GESTION DE RECURSOS INFORMATICOS
1732;"6209";OTROS SERVICIOS RELACIONADOS CON LAS TECNOLOGIAS DE LA INFORMACION Y LA INFORMATICA
1735;"6311";"PROCESO DE DATOS; HOSTING Y ACTIVIDADES RELACIONADAS"
1736;"6312";PORTALES WEB
1738;"6391";ACTIVIDADES DE LAS AGENCIAS DE NOTICIAS
1739;"6399";OTROS SERVICIOS DE INFORMACION N.C.O.P.
1743;"6411";BANCO CENTRAL
1744;"6419";OTRA INTERMEDIACION MONETARIA
1746;"6420";ACTIVIDADES DE LAS SOCIEDADES HOLDING
1748;"6430";"INVERSION COLECTIVA; FONDOS Y ENTIDADES FINANCIERAS SIMILARES"
1750;"6491";ARRENDAMIENTO FINANCIERO
1751;"6492";OTRAS ACTIVIDADES CREDITICIAS
1752;"6499";"OTROS SERVICIOS FINANCIEROS; EXCEPTO SEGUROS Y FONDOS DE PENSIONES N.C.O.P."
1755;"6511";SEGUROS DE VIDA
1756;"6512";SEGUROS DISTINTOS DE LOS SEGUROS DE VIDA
1758;"6520";REASEGUROS
1760;"6530";FONDOS DE PENSIONES
1763;"6611";ADMINISTRACION DE MERCADOS FINANCIEROS
1764;"6612";ACTIVIDADES DE INTERMEDIACION EN OPERACIONES CON VALORES Y OTROS ACTIVOS
1765;"6619";"OTRAS ACTIVIDADES AUXILIARES A LOS SERVICIOS FINANCIEROS; EXCEPTO SEGUROS Y FONDOS DE PENSIONES"
1767;"6621";EVALUACION DE RIESGOS Y DAÑOS
1768;"6622";ACTIVIDADES DE AGENTES Y CORREDORES DE SEGUROS
1769;"6629";OTRAS ACTIVIDADES AUXILIARES A SEGUROS Y FONDOS DE PENSIONES
1771;"6630";ACTIVIDADES DE GESTION DE FONDOS
1775;"6810";COMPRAVENTA DE BIENES INMOBILIARIOS POR CUENTA PROPIA
1777;"6820";ALQUILER DE BIENES INMOBILIARIOS POR CUENTA PROPIA
1779;"6831";AGENTES DE LA PROPIEDAD INMOBILIARIA
1780;"6832";GESTION Y ADMINISTRACION DE LA PROPIEDAD INMOBILIARIA
1784;"6910";ACTIVIDADES JURIDICAS
1786;"6920";"ACTIVIDADES DE CONTABILIDAD; TENEDURIA DE LIBROS; AUDITORIA Y ASESORIA FISCAL"
1789;"7010";ACTIVIDADES DE LAS SEDES CENTRALES
1791;"7021";RELACIONES PUBLICAS Y COMUNICACION
1792;"7022";OTRAS ACTIVIDADES DE CONSULTORIA DE GESTION EMPRESARIAL
1795;"7111";SERVICIOS TECNICOS DE ARQUITECTURA
1796;"7112";SERVICIOS TECNICOS DE INGENIERIA Y OTRAS ACTIVIDADES RELACIONADAS CON EL ASESORAMIENTO TECNICO
1798;"7120";ENSAYOS Y ANALISIS TECNICOS
1801;"7211";INVESTIGACION Y DESARROLLO EXPERIMENTAL EN BIOTECNOLOGIA
1802;"7219";OTRA INVESTIGACION Y DESARROLLO EXPERIMENTAL EN CIENCIAS NATURALES Y TECNICAS
1804;"7220";INVESTIGACION Y DESARROLLO EXPERIMENTAL EN CIENCIAS SOCIALES Y HUMANIDADES
1807;"7311";AGENCIAS DE PUBLICIDAD
1808;"7312";SERVICIOS DE REPRESENTACION DE MEDIOS DE COMUNICACION
1810;"7320";ESTUDIO DE MERCADO Y REALIZACION DE ENCUESTAS DE OPINION PUBLICA
1813;"7410";ACTIVIDADES DE DISEÑO ESPECIALIZADO
1815;"7420";ACTIVIDADES DE FOTOGRAFIA
1817;"7430";ACTIVIDADES DE TRADUCCION E INTERPRETACION
1819;"7490";"OTRAS ACTIVIDADES PROFESIONALES; CIENTIFICAS Y TECNICAS N.C.O.P."
1822;"7500";ACTIVIDADES VETERINARIAS
1826;"7711";ALQUILER DE AUTOMOVILES Y VEHICULOS DE MOTOR LIGEROS
1827;"7712";ALQUILER DE CAMIONES
1829;"7721";ALQUILER DE ARTICULOS DE OCIO Y DEPORTIVOS
1830;"7722";ALQUILER DE CINTAS DE VIDEO Y DISCOS
1831;"7729";ALQUILER DE OTROS EFECTOS PERSONALES Y ARTICULOS DE USO DOMESTICO
1833;"7731";ALQUILER DE MAQUINARIA Y EQUIPO DE USO AGRICOLA
1834;"7732";ALQUILER DE MAQUINARIA Y EQUIPO PARA LA CONSTRUCCION E INGENIERIA CIVIL
1835;"7733";"ALQUILER DE MAQUINARIA Y EQUIPO DE OFICINA; INCLUIDOS ORDENADORES"
1836;"7734";ALQUILER DE MEDIOS DE NAVEGACION
1837;"7735";ALQUILER DE MEDIOS DE TRANSPORTE AEREO
1838;"7739";"ALQUILER DE OTRA MAQUINARIA; EQUIPOS Y BIENES TANGIBLES N.C.O.P."
1840;"7740";"ARRENDAMIENTO DE LA PROPIEDAD INTELECTUAL Y PRODUCTOS SIMILARES; EXCEPTO TRABAJOS PROTEGIDOS POR LOS DERECHOS DE AUTOR"
1843;"7810";ACTIVIDADES DE LAS AGENCIAS DE COLOCACION
1845;"7820";ACTIVIDADES DE LAS EMPRESAS DE TRABAJO TEMPORAL
1847;"7830";OTRA PROVISION DE RECURSOS HUMANOS
1850;"7911";ACTIVIDADES DE LAS AGENCIAS DE VIAJES
1851;"7912";ACTIVIDADES DE LOS OPERADORES TURISTICOS
1853;"7990";OTROS SERVICIOS DE RESERVAS Y ACTIVIDADES RELACIONADAS CON LOS MISMOS
1856;"8010";ACTIVIDADES DE SEGURIDAD PRIVADA
1858;"8020";SERVICIOS DE SISTEMAS DE SEGURIDAD
1860;"8030";ACTIVIDADES DE INVESTIGACION
1863;"8110";SERVICIOS INTEGRALES A EDIFICIOS E INSTALACIONES
1865;"8121";LIMPIEZA GENERAL DE EDIFICIOS
1866;"8122";OTRAS ACTIVIDADES DE LIMPIEZA INDUSTRIAL Y DE EDIFICIOS
1867;"8129";OTRAS ACTIVIDADES DE LIMPIEZA
1869;"8130";ACTIVIDADES DE JARDINERIA
1872;"8211";SERVICIOS ADMINISTRATIVOS COMBINADOS
1873;"8219";"ACTIVIDADES DE FOTOCOPIADO; PREPARACION DE DOCUMENTOS Y OTRAS ACTIVIDADES ESPECIALIZADAS DE OFICINA"
1875;"8220";ACTIVIDADES DE LOS CENTROS DE LLAMADAS
1877;"8230";ORGANIZACION DE CONVENCIONES Y FERIAS DE MUESTRAS
1879;"8291";ACTIVIDADES DE LAS AGENCIAS DE COBROS Y DE INFORMACION COMERCIAL
1880;"8292";ACTIVIDADES DE ENVASADO Y EMPAQUETADO
1881;"8299";OTRAS ACTIVIDADES DE APOYO A LAS EMPRESAS N.C.O.P.
1885;"8411";ACTIVIDADES GENERALES DE LA ADMINISTRACION PUBLICA
1886;"8412";"REGULACION DE LAS ACTIVIDADES SANITARIAS; EDUCATIVAS Y CULTURALES Y/O REGULACION DE LAS ACTIVIDADES SANITARIAS; EDUCATIVAS Y CULTURALES Y OTROS SERVICIOS SOCIALES; EXCEPTO SEGURIDAD SOCIAL"
1887;"8413";REGULACION DE LA ACTIVIDAD ECONOMICA Y CONTRIBUCION A SU MAYOR EFICIENCIA
1889;"8421";ASUNTOS EXTERIORES
1890;"8422";DEFENSA
1891;"8423";JUSTICIA
1892;"8424";ORDEN PUBLICO Y SEGURIDAD
1893;"8425";PROTECCION CIVIL
1895;"8430";SEGURIDAD SOCIAL OBLIGATORIA
1899;"8510";EDUCACION PREPRIMARIA
1901;"8520";EDUCACION PRIMARIA
1903;"8531";EDUCACION SECUNDARIA GENERAL
1904;"8532";EDUCACION SECUNDARIA TECNICA Y PROFESIONAL
1906;"8541";EDUCACION POSTSECUNDARIA NO TERCIARIA
1907;"8543";EDUCACION UNIVERSITARIA
1908;"8544";EDUCACION TERCIARIA NO UNIVERSITARIA
1910;"8551";EDUCACION DEPORTIVA Y RECREATIVA
1911;"8552";EDUCACION CULTURAL
1912;"8553";ACTIVIDADES DE LAS ESCUELAS DE CONDUCCION Y PILOTAJE
1913;"8559";OTRA EDUCACION N.C.O.P.
1915;"8560";ACTIVIDADES AUXILIARES A LA EDUCACION
1919;"8610";ACTIVIDADES HOSPITALARIAS
1921;"8621";ACTIVIDADES DE MEDICINA GENERAL
1922;"8622";ACTIVIDADES DE MEDICINA ESPECIALIZADA
1923;"8623";ACTIVIDADES ODONTOLOGICAS
1925;"8690";OTRAS ACTIVIDADES SANITARIAS
1928;"8710";ASISTENCIA EN ESTABLECIMIENTOS RESIDENCIALES CON CUIDADOS SANITARIOS
1930;"8720";"ASISTENCIA EN ESTABLECIMIENTOS RESIDENCIALES PARA PERSONAS CON DISCAPACIDAD INTELECTUAL; ENFERMEDAD MENTAL Y DROGODEPENDENCIA"
1932;"8731";ASISTENCIA EN ESTABLECIMIENTOS RESIDENCIALES PARA PERSONAS MAYORES
1933;"8732";ASISTENCIA EN ESTABLECIMIENTOS RESIDENCIALES PARA PERSONAS CON DISCAPACIDAD FISICA
1935;"8790";OTRAS ACTIVIDADES DE ASISTENCIA EN ESTABLECIMIENTOS RESIDENCIALES
1938;"8811";ACTIVIDADES DE SERVICIOS SOCIALES SIN ALOJAMIENTO PARA PERSONAS MAYORES
1939;"8812";ACTIVIDADES DE SERVICIOS SOCIALES SIN ALOJAMIENTO PARA PERSONAS CON DISCAPACIDAD
1941;"8891";ACTIVIDADES DE CUIDADO DIURNO DE NIÑOS
1942;"8899";OTROS ACTIVIDADES DE SERVICIOS SOCIALES SIN ALOJAMIENTO N.C.O.P.
1946;"9001";ARTES ESCENICAS
1947;"9002";ACTIVIDADES AUXILIARES A LAS ARTES ESCENICAS
1948;"9003";CREACION ARTISTICA Y LITERARIA
1949;"9004";GESTION DE SALAS DE ESPECTACULOS
1952;"9102";ACTIVIDADES DE MUSEOS
1953;"9103";GESTION DE LUGARES Y EDIFICIOS HISTORICOS
1954;"9104";"ACTIVIDADES DE LOS JARDINES BOTANICOS; PARQUES ZOOLOGICOS Y RESERVAS NATURALES"
1955;"9105";ACTIVIDADES DE BIBLIOTECAS
1956;"9106";ACTIVIDADES DE ARCHIVOS
1959;"9200";ACTIVIDADES DE JUEGOS DE AZAR Y APUESTAS
1962;"9311";GESTION DE INSTALACIONES DEPORTIVAS
1963;"9312";ACTIVIDADES DE LOS CLUBES DEPORTIVOS
1964;"9313";ACTIVIDADES DE LOS GIMNASIOS
1965;"9319";OTRAS ACTIVIDADES DEPORTIVAS
1967;"9321";ACTIVIDADES DE LOS PARQUES DE ATRACCIONES Y LOS PARQUES TEMATICOS
1968;"9329";OTRAS ACTIVIDADES RECREATIVAS Y DE ENTRETENIMIENTO
1972;"9411";ACTIVIDADES DE ORGANIZACIONES EMPRESARIALES Y PATRONALES
1973;"9412";ACTIVIDADES DE ORGANIZACIONES PROFESIONALES
1975;"9420";ACTIVIDADES SINDICALES
1977;"9491";ACTIVIDADES DE ORGANIZACIONES RELIGIOSAS
1978;"9492";ACTIVIDADES DE ORGANIZACIONES POLITICAS
1979;"9499";OTRAS ACTIVIDADES ASOCIATIVAS N.C.O.P.
